{"$schema": "cwi.listening-session/1.0", "generated": "2026-09-16", "maintainer": "Cumulative Web Inc", "note": "Setlists are drawn only from the verified 35-track CWI catalog (catalog.json, cwi.catalog/2.0, 2026-09-16). Entries with spotify_track_id null have no verified Spotify link on file and are labeled as listening spotlights, never embedded.", "sessions": [{"description": "We open the Listening Room by celebrating real, verified wins: three That Boy Hi Hat tracks holding on Spotify's New Rap Hits, plus the singles that got them there. Press play together at 8:00 PM ET sharp.", "host": "CWI Radio", "id": "victory-lap-2026-09-18", "setlist": [{"artist": "That Boy Hi Hat", "spotify_track_id": "3pQEzg7xFqGIk0CK1Za1Kw", "title": "Shaka Zulu"}, {"artist": "That Boy Hi Hat", "spotify_track_id": "0emH8ktA8x4DkOFLsG5xkW", "title": "Zooted Zone"}, {"artist": "That Boy Hi Hat", "spotify_track_id": "4NAyd7rvnuG3DrPFqXo4eQ", "title": "Doves & Diamonds"}, {"artist": "That Boy Hi Hat", "spotify_track_id": "2eSyWmIdPzEMyWejLb2LBj", "title": "Diabolique"}, {"artist": "That Boy Hi Hat", "spotify_track_id": "2daugr3ni3r6jHH6UI57EK", "title": "Ultimate"}, {"artist": "That Boy Hi Hat", "spotify_track_id": "2MDHAUo4zJTHGXGQHUhNw0", "title": "Flamerz"}], "starts_at": "2026-09-18T20:00:00-04:00", "theme": "New Rap Hits Victory Lap", "timezone": "America/New_York"}, {"description": "A full hour inside the King Akeem catalog: seven tracks, zero skips. These tracks have no verified Spotify streaming link on file yet, so this session is a guided listening spotlight \u2014 request links via hp@cumulativeweb.com.", "host": "CWI A&R", "id": "king-akeem-deep-dive-2026-09-25", "setlist": [{"artist": "That Boy Hi Hat", "spotify_track_id": "4RFWRhPn8NX0DTQPpl1swe", "title": "Golden Diamond"}, {"artist": "That Boy Hi Hat", "spotify_track_id": "6YQq5GsaUmanh0XyHQIGoR", "title": "Scorpions & Sapphires"}, {"artist": "King Akeem", "spotify_track_id": null, "title": "Star"}, {"artist": "King Akeem", "spotify_track_id": null, "title": "Super Solid"}, {"artist": "King Akeem", "spotify_track_id": null, "title": "Embiid"}, {"artist": "King Akeem", "spotify_track_id": null, "title": "Bluefaces 3.0"}, {"artist": "King Akeem", "spotify_track_id": null, "title": "Goated"}, {"artist": "King Akeem", "spotify_track_id": null, "title": "Element"}, {"artist": "King Akeem", "spotify_track_id": null, "title": "Summer Night FAST"}], "starts_at": "2026-09-25T20:00:00-04:00", "theme": "King Akeem Deep Dive", "timezone": "America/New_York"}, {"description": "183 Wildboi brings the rock-rap revival: Stunt, Full Moon. No verified Spotify links on file for these yet \u2014 spotlight session. We open and close with That Boy Hi Hat's heaviest verified cuts.", "host": "CWI A&R", "id": "wildboi-rock-rap-2026-10-02", "setlist": [{"artist": "That Boy Hi Hat", "spotify_track_id": "3w4RKguHAT2xd9K0w5CklC", "title": "Warped & Wicked"}, {"artist": "That Boy Hi Hat", "spotify_track_id": "2aTbpxiF2jNiB3PGi81oqa", "title": "Toxic Element"}, {"artist": "183 Wildboi", "spotify_track_id": null, "title": "Stunt"}, {"artist": "183 Wildboi", "spotify_track_id": null, "title": "Full Moon"}, {"artist": "That Boy Hi Hat", "spotify_track_id": "6jJpR9IhQ9PmRPJpxLlOmK", "title": "Smokin' Pain"}, {"artist": "That Boy Hi Hat", "spotify_track_id": "4Z5UCQLqWzpPeihPTZ9Gqg", "title": "Misfits and Hooligans"}], "starts_at": "2026-10-02T20:00:00-04:00", "theme": "183 Wildboi Rock-Rap Night", "timezone": "America/New_York"}, {"description": "Dre50's Pix leads a global-vibes session: afrobeats energy, late-night R&B textures, and That Boy Hi Hat's most atmospheric verified cuts. Pix has no verified Spotify link on file \u2014 spotlight session.", "host": "CWI Sync", "id": "dre50-global-vibes-2026-10-09", "setlist": [{"artist": "That Boy Hi Hat", "spotify_track_id": "4XP56LZjeS0TJUd30kpGSK", "title": "Neon Nights Pt. 777"}, {"artist": "That Boy Hi Hat", "spotify_track_id": "3r86CjoxCNvvCz98h2btm1", "title": "Roses over Monaco"}, {"artist": "Dre50", "spotify_track_id": null, "title": "Pix"}, {"artist": "That Boy Hi Hat", "spotify_track_id": "2ZUYjQGsRLHRcsfgyeAWpo", "title": "Rainbows And Roses"}, {"artist": "That Boy Hi Hat", "spotify_track_id": "31MTBSMfWy4jGEYAilkaH8", "title": "Place I Go to Dream (Remastered)"}, {"artist": "That Boy Hi Hat", "spotify_track_id": "6nhzq7P7x09aUbPts4ywFl", "title": "Painted Lady"}], "starts_at": "2026-10-09T20:00:00-04:00", "theme": "Dre50 Global Vibes", "timezone": "America/New_York"}]}